{
  "$schema": "../../mirador/schemas/scene.v1.schema.json",
  "schema_version": "1",
  "id": "scene_best50000",
  "title": "Apartamento en Chapinero",
  "metric": {
    "area_m2": 92,
    "rooms": 3,
    "bathrooms": 2,
    "verified_by": "unverified"
  },
  "render": {
    "format": "spz",
    "url": "scene.spz",
    "splat_budget_desktop": 2000000,
    "splat_budget_mobile": 2000000,
    "up_axis": [0, 1, 0],
    "yaw_correction_deg": 0,
    "pitch_correction_deg": 0
  },
  "camera_default": {
    "pos": [1.6289, 0.1848, 0.0622],
    "quat": [0.0178, 0.1171, -0.0021, 0.993],
    "fov": 60
  },
  "waypoints": [
    {
      "id": "w_vista2",
      "label": "Vista2",
      "pos": [-0.0612, 0.1676, -6.2066],
      "quat": [-0.0025, 0.9935, -0.0221, -0.1113],
      "transition_ms": 1200
    },
    {
      "id": "w_vista3",
      "label": "Vista3",
      "pos": [0.6947, 0.1813, -0.8963],
      "quat": [-0.0077, -0.7236, -0.0081, 0.6901],
      "transition_ms": 1200
    }
  ],
  "hotspots": [],
  "listing": {
    "neighborhood": "Chapinero",
    "city": "Bogotá",
    "description_md": "Apartamento demo — tour 3D Mirador (splats de prueba).",
    "agent_whatsapp": "+573043362502"
  },
  "branding": {
    "tenant_id": "mirador",
    "show_mirador_badge": true,
    "primary_color": "#5e5956"
  },
  "access": { "visibility": "public" },
  "attribution": {
    "capture_date": "2026-05-21",
    "pipeline": "Marble export SPZ — pitch_correction_deg 0 (Marble/Spark Y-up; SOG Postshot uses 180)",
    "converter": "Marble / Niantic SPZ"
  }
}
