{
  "$schema": "../../mirador/schemas/scene.v1.schema.json",
  "schema_version": "1",
  "id": "scene_laureles01",
  "title": "Estudio cerca al parque — Laureles",
  "metric": {
    "area_m2": 48,
    "rooms": 1,
    "bathrooms": 1,
    "verified_by": "unverified"
  },
  "render": {
    "format": "spz",
    "url": "scene.spz",
    "splat_budget_desktop": 2000000,
    "splat_budget_mobile": 2000000,
    "up_axis": [0, 1, 0],
    "yaw_correction_deg": 0,
    "pitch_correction_deg": 0
  },
  "waypoints": [
    {
      "id": "w_living",
      "label": "Estudio",
      "pos": [0, 1.6, 3],
      "quat": [0, 0, 0, 1],
      "transition_ms": 1200
    }
  ],
  "hotspots": [],
  "listing": {
    "neighborhood": "Laureles",
    "city": "Medellín",
    "description_md": "Estudio demo — tour 3D Mirador (splats de prueba).",
    "agent_whatsapp": "+573001234567"
  },
  "branding": {
    "tenant_id": "mirador",
    "show_mirador_badge": true,
    "primary_color": "#5e5956"
  },
  "access": { "visibility": "public" },
  "attribution": {
    "capture_date": "2026-05-21",
    "pipeline": "Marble export SPZ — pitch_correction_deg 0 (Marble/Spark Y-up; SOG Postshot uses 180)",
    "converter": "Marble / Niantic SPZ"
  }
}
